id,project,title,description,categories,logo,file_name,origin_format,origin_url,swaggerYamlUrl,swaggerYamlUrl,import_id,swaggerUrl
345187,amazonaws.com:cloudsearch,Amazon CloudSearch," You use the Amazon CloudSearch configuration service to create, configure, and manage search domains. Configuration service requests are submitted using the AWS Query protocol. AWS Query requests are HTTP or HTTPS requests submitted via HTTP GET or POST with a query parameter named Action. The endpoint for configuration service requests is region-specific: cloudsearch.<i>region</i>.amazonaws.com. For example, cloudsearch.us-east-1.amazonaws.com. For a current list of supported regions and endpoints, see <a href=""http://docs.aws.amazon.com/general/latest/gr/rande.html#cloudsearch_region"" target=""_blank"">Regions and Endpoints.",cloud,https://api.apis.guru/v2/cache/logo/https_twitter.com_awscloud_profile_image.png,https_twitter.com_awscloud_profile_image.png,,https://raw.githubusercontent.com/aws/aws-sdk-js/master/apis/cloudsearch-2013-01-01.normal.json,https://api.apis.guru/v2/specs/amazonaws.com/cloudsearch/2013-01-01/openapi.yaml,https://api.apis.guru/v2/specs/amazonaws.com/cloudsearch/2013-01-01/openapi.yaml,345333,/amazonaws.com/cloudsearch/2013-01-01/openapi.json
345188,amazonaws.com:codeguru-reviewer,Amazon CodeGuru Reviewer,"This section provides documentation for the Amazon CodeGuru Reviewer API operations. CodeGuru Reviewer is a service that uses program analysis and machine learning to detect potential defects that are difficult for developers to find and recommends fixes in your Java and Python code. By proactively detecting and providing recommendations for addressing code defects and implementing best practices, CodeGuru Reviewer improves the overall quality and maintainability of your code base during the code review stage. For more information about CodeGuru Reviewer, see the <i> <a href=""https://docs.aws.amazon.com/codeguru/latest/reviewer-ug/welcome.html"">Amazon CodeGuru Reviewer User Guide.</i>   To improve the security of your CodeGuru Reviewer API calls, you can establish a private connection between your VPC and CodeGuru Reviewer by creating an <i>interface VPC endpoint</i>. For more information, see <a href=""https://docs.aws.amazon.com/codeguru/latest/reviewer-ug/vpc-interface-endpoints.html"">CodeGuru Reviewer and interface VPC endpoints (Amazon Web Services PrivateLink) in the <i>Amazon CodeGuru Reviewer User Guide</i>. ",cloud,https://api.apis.guru/v2/cache/logo/https_twitter.com_awscloud_profile_image.png,https_twitter.com_awscloud_profile_image.png,,https://raw.githubusercontent.com/aws/aws-sdk-js/master/apis/codeguru-reviewer-2019-09-19.normal.json,https://api.apis.guru/v2/specs/amazonaws.com/codeguru-reviewer/2019-09-19/openapi.yaml,https://api.apis.guru/v2/specs/amazonaws.com/codeguru-reviewer/2019-09-19/openapi.yaml,345334,/amazonaws.com/codeguru-reviewer/2019-09-19/openapi.json
345189,ably.net:control,Control API v1,"Use the Control API to manage your applications, namespaces, keys, queues, rules, and more.Detailed information on using this API can be found in the Ably <a href=""https://ably.com/documentation/control-api"">developer documentation.Control API is currently in Beta.",cloud,https://api.apis.guru/v2/cache/logo/https_twitter.com_ablyrealtime_profile_image,https_twitter.com_ablyrealtime_profile_image,openapi,https://raw.githubusercontent.com/ably/open-specs/main/definitions/control-v1.yaml,https://api.apis.guru/v2/specs/ably.net/control/1.0.14/openapi.yaml,https://api.apis.guru/v2/specs/ably.net/control/1.0.14/openapi.yaml,345335,/ably.net/control/1.0.14/openapi.json
345190,amazonaws.com:apigatewaymanagementapi,AmazonApiGatewayManagementApi,"The Amazon API Gateway Management API allows you to directly manage runtime aspects of your deployed APIs. To use it, you must explicitly set the SDK's endpoint to point to the endpoint of your deployed API. The endpoint will be of the form https://{api-id}.execute-api.{region}.amazonaws.com/{stage}, or will be the endpoint corresponding to your API's custom domain and base path, if applicable.",cloud,https://api.apis.guru/v2/cache/logo/https_twitter.com_awscloud_profile_image.png,https_twitter.com_awscloud_profile_image.png,,https://raw.githubusercontent.com/aws/aws-sdk-js/master/apis/apigatewaymanagementapi-2018-11-29.normal.json,https://api.apis.guru/v2/specs/amazonaws.com/apigatewaymanagementapi/2018-11-29/openapi.yaml,https://api.apis.guru/v2/specs/amazonaws.com/apigatewaymanagementapi/2018-11-29/openapi.yaml,345336,/amazonaws.com/apigatewaymanagementapi/2018-11-29/openapi.json
345191,amazonaws.com:connectparticipant,Amazon Connect Participant Service,"Amazon Connect is a cloud-based contact center solution that makes it easy to set up and manage a customer contact center and provide reliable customer engagement at any scale. Amazon Connect enables customer contacts through voice or chat. The APIs described here are used by chat participants, such as agents and customers.",cloud,https://api.apis.guru/v2/cache/logo/https_twitter.com_awscloud_profile_image.png,https_twitter.com_awscloud_profile_image.png,,https://raw.githubusercontent.com/aws/aws-sdk-js/master/apis/connectparticipant-2018-09-07.normal.json,https://api.apis.guru/v2/specs/amazonaws.com/connectparticipant/2018-09-07/openapi.yaml,https://api.apis.guru/v2/specs/amazonaws.com/connectparticipant/2018-09-07/openapi.yaml,345337,/amazonaws.com/connectparticipant/2018-09-07/openapi.json
345192,amazonaws.com:apprunner,AWS App Runner," AWS App Runner is an application service that provides a fast, simple, and cost-effective way to go directly from an existing container image or source code to a running service in the AWS cloud in seconds. You don't need to learn new technologies, decide which compute service to use, or understand how to provision and configure AWS resources. App Runner connects directly to your container registry or source code repository. It provides an automatic delivery pipeline with fully managed operations, high performance, scalability, and security. For more information about App Runner, see the <a href=""https://docs.aws.amazon.com/apprunner/latest/dg/"">AWS App Runner Developer Guide. For release information, see the <a href=""https://docs.aws.amazon.com/apprunner/latest/relnotes/"">AWS App Runner Release Notes.  To install the Software Development Kits (SDKs), Integrated Development Environment (IDE) Toolkits, and command line tools that you can use to access the API, see <a href=""http://aws.amazon.com/tools/"">Tools for Amazon Web Services.  <b>Endpoints</b>  For a list of Region-specific endpoints that App Runner supports, see <a href=""https://docs.aws.amazon.com/general/latest/gr/apprunner.html"">AWS App Runner endpoints and quotas in the <i>AWS General Reference</i>.",cloud,https://api.apis.guru/v2/cache/logo/https_twitter.com_awscloud_profile_image.png,https_twitter.com_awscloud_profile_image.png,,https://raw.githubusercontent.com/aws/aws-sdk-js/master/apis/apprunner-2020-05-15.normal.json,https://api.apis.guru/v2/specs/amazonaws.com/apprunner/2020-05-15/openapi.yaml,https://api.apis.guru/v2/specs/amazonaws.com/apprunner/2020-05-15/openapi.yaml,345338,/amazonaws.com/apprunner/2020-05-15/openapi.json
345193,amazonaws.com:comprehendmedical,AWS Comprehend Medical, Amazon Comprehend Medical extracts structured information from unstructured clinical text. Use these actions to gain insight in your documents. ,cloud,https://api.apis.guru/v2/cache/logo/https_twitter.com_awscloud_profile_image.png,https_twitter.com_awscloud_profile_image.png,,https://raw.githubusercontent.com/aws/aws-sdk-js/master/apis/comprehendmedical-2018-10-30.normal.json,https://api.apis.guru/v2/specs/amazonaws.com/comprehendmedical/2018-10-30/openapi.yaml,https://api.apis.guru/v2/specs/amazonaws.com/comprehendmedical/2018-10-30/openapi.yaml,345339,/amazonaws.com/comprehendmedical/2018-10-30/openapi.json
345194,amazonaws.com:budgets,AWS Budgets,"The AWS Budgets API enables you to use AWS Budgets to plan your service usage, service costs, and instance reservations. The API reference provides descriptions, syntax, and usage examples for each of the actions and data types for AWS Budgets.  Budgets provide you with a way to see the following information:   How close your plan is to your budgeted amount or to the free tier limits   Your usage-to-date, including how much you've used of your Reserved Instances (RIs)   Your current estimated charges from AWS, and how much your predicted usage will accrue in charges by the end of the month   How much of your budget has been used   AWS updates your budget status several times a day. Budgets track your unblended costs, subscriptions, refunds, and RIs. You can create the following types of budgets:    <b>Cost budgets</b> - Plan how much you want to spend on a service.    <b>Usage budgets</b> - Plan how much you want to use one or more services.    <b>RI utilization budgets</b> - Define a utilization threshold, and receive alerts when your RI usage falls below that threshold. This lets you see if your RIs are unused or under-utilized.    <b>RI coverage budgets</b> - Define a coverage threshold, and receive alerts when the number of your instance hours that are covered by RIs fall below that threshold. This lets you see how much of your instance usage is covered by a reservation.   Service Endpoint The AWS Budgets API provides the following endpoint:   https://budgets.amazonaws.com   For information about costs that are associated with the AWS Budgets API, see <a href=""https://aws.amazon.com/aws-cost-management/pricing/"">AWS Cost Management Pricing.",cloud,https://api.apis.guru/v2/cache/logo/https_twitter.com_awscloud_profile_image.png,https_twitter.com_awscloud_profile_image.png,,https://raw.githubusercontent.com/aws/aws-sdk-js/master/apis/budgets-2016-10-20.normal.json,https://api.apis.guru/v2/specs/amazonaws.com/budgets/2016-10-20/openapi.yaml,https://api.apis.guru/v2/specs/amazonaws.com/budgets/2016-10-20/openapi.yaml,345340,/amazonaws.com/budgets/2016-10-20/openapi.json
345195,amazonaws.com:codepipeline,AWS CodePipeline,"  <b>Overview</b>  This is the AWS CodePipeline API Reference. This guide provides descriptions of the actions and data types for AWS CodePipeline. Some functionality for your pipeline can only be configured through the API. For more information, see the <a href=""https://docs.aws.amazon.com/codepipeline/latest/userguide/welcome.html"">AWS CodePipeline User Guide. You can use the AWS CodePipeline API to work with pipelines, stages, actions, and transitions.  <i>Pipelines</i> are models of automated release processes. Each pipeline is uniquely named, and consists of stages, actions, and transitions.  You can work with pipelines by calling:    CreatePipeline, which creates a uniquely named pipeline.    DeletePipeline, which deletes the specified pipeline.    GetPipeline, which returns information about the pipeline structure and pipeline metadata, including the pipeline Amazon Resource Name (ARN).    GetPipelineExecution, which returns information about a specific execution of a pipeline.    GetPipelineState, which returns information about the current state of the stages and actions of a pipeline.    ListActionExecutions, which returns action-level details for past executions. The details include full stage and action-level details, including individual action duration, status, any errors that occurred during the execution, and input and output artifact location details.    ListPipelines, which gets a summary of all of the pipelines associated with your account.    ListPipelineExecutions, which gets a summary of the most recent executions for a pipeline.    StartPipelineExecution, which runs the most recent revision of an artifact through the pipeline.    StopPipelineExecution, which stops the specified pipeline execution from continuing through the pipeline.    UpdatePipeline, which updates a pipeline with edits or changes to the structure of the pipeline.   Pipelines include <i>stages</i>. Each stage contains one or more actions that must complete before the next stage begins. A stage results in success or failure. If a stage fails, the pipeline stops at that stage and remains stopped until either a new version of an artifact appears in the source location, or a user takes action to rerun the most recent artifact through the pipeline. You can call GetPipelineState, which displays the status of a pipeline, including the status of stages in the pipeline, or GetPipeline, which returns the entire structure of the pipeline, including the stages of that pipeline. For more information about the structure of stages and actions, see <a href=""https://docs.aws.amazon.com/codepipeline/latest/userguide/pipeline-structure.html"">AWS CodePipeline Pipeline Structure Reference. Pipeline stages include <i>actions</i> that are categorized into categories such as source or build actions performed in a stage of a pipeline. For example, you can use a source action to import artifacts into a pipeline from a source such as Amazon S3. Like stages, you do not work with actions directly in most cases, but you do define and interact with actions when working with pipeline operations such as CreatePipeline and GetPipelineState. Valid action categories are:   Source   Build   Test   Deploy   Approval   Invoke   Pipelines also include <i>transitions</i>, which allow the transition of artifacts from one stage to the next in a pipeline after the actions in one stage complete. You can work with transitions by calling:    DisableStageTransition, which prevents artifacts from transitioning to the next stage in a pipeline.    EnableStageTransition, which enables transition of artifacts between stages in a pipeline.     <b>Using the API to integrate with AWS CodePipeline</b>  For third-party integrators or developers who want to create their own integrations with AWS CodePipeline, the expected sequence varies from the standard API user. To integrate with AWS CodePipeline, developers need to work with the following items:  <b>Jobs</b>, which are instances of an action. For example, a job for a source action might import a revision of an artifact from a source.  You can work with jobs by calling:    AcknowledgeJob, which confirms whether a job worker has received the specified job.    GetJobDetails, which returns the details of a job.    PollForJobs, which determines whether there are any jobs to act on.    PutJobFailureResult, which provides details of a job failure.     PutJobSuccessResult, which provides details of a job success.    <b>Third party jobs</b>, which are instances of an action created by a partner action and integrated into AWS CodePipeline. Partner actions are created by members of the AWS Partner Network. You can work with third party jobs by calling:    AcknowledgeThirdPartyJob, which confirms whether a job worker has received the specified job.    GetThirdPartyJobDetails, which requests the details of a job for a partner action.    PollForThirdPartyJobs, which determines whether there are any jobs to act on.     PutThirdPartyJobFailureResult, which provides details of a job failure.    PutThirdPartyJobSuccessResult, which provides details of a job success.  ",cloud,https://api.apis.guru/v2/cache/logo/https_twitter.com_awscloud_profile_image.png,https_twitter.com_awscloud_profile_image.png,,https://raw.githubusercontent.com/aws/aws-sdk-js/master/apis/codepipeline-2015-07-09.normal.json,https://api.apis.guru/v2/specs/amazonaws.com/codepipeline/2015-07-09/openapi.yaml,https://api.apis.guru/v2/specs/amazonaws.com/codepipeline/2015-07-09/openapi.yaml,345341,/amazonaws.com/codepipeline/2015-07-09/openapi.json
345196,adyen.com:TestCardService,Adyen Test Cards API,"The Test Cards API provides endpoints for generating custom test card numbers. For more information, refer to [Custom test cards](https://docs.adyen.com/development-resources/test-cards/create-test-cards) documentation.",payment,https://api.apis.guru/v2/cache/logo/https_twitter.com_Adyen_profile_image.jpeg,https_twitter.com_Adyen_profile_image.jpeg,openapi,https://raw.githubusercontent.com/Adyen/adyen-openapi/master/json/TestCardService-v1.json,https://api.apis.guru/v2/specs/adyen.com/TestCardService/1/openapi.yaml,https://api.apis.guru/v2/specs/adyen.com/TestCardService/1/openapi.yaml,345342,/adyen.com/TestCardService/1/openapi.json
345197,amazonaws.com:compute-optimizer,AWS Compute Optimizer,"Compute Optimizer is a service that analyzes the configuration and utilization metrics of your Amazon Web Services compute resources, such as Amazon EC2 instances, Amazon EC2 Auto Scaling groups, Lambda functions, and Amazon EBS volumes. It reports whether your resources are optimal, and generates optimization recommendations to reduce the cost and improve the performance of your workloads. Compute Optimizer also provides recent utilization metric data, in addition to projected utilization metric data for the recommendations, which you can use to evaluate which recommendation provides the best price-performance trade-off. The analysis of your usage patterns can help you decide when to move or resize your running resources, and still meet your performance and capacity requirements. For more information about Compute Optimizer, including the required permissions to use the service, see the <a href=""https://docs.aws.amazon.com/compute-optimizer/latest/ug/"">Compute Optimizer User Guide.",cloud,https://api.apis.guru/v2/cache/logo/https_twitter.com_awscloud_profile_image.png,https_twitter.com_awscloud_profile_image.png,,https://raw.githubusercontent.com/aws/aws-sdk-js/master/apis/compute-optimizer-2019-11-01.normal.json,https://api.apis.guru/v2/specs/amazonaws.com/compute-optimizer/2019-11-01/openapi.yaml,https://api.apis.guru/v2/specs/amazonaws.com/compute-optimizer/2019-11-01/openapi.yaml,345343,/amazonaws.com/compute-optimizer/2019-11-01/openapi.json
345198,adyen.com:BinLookupService,Adyen BinLookup API,"The BIN Lookup API provides endpoints for retrieving information, such as cost estimates, and 3D Secure supported version based on a given BIN.",payment,https://api.apis.guru/v2/cache/logo/https_twitter.com_Adyen_profile_image.jpeg,https_twitter.com_Adyen_profile_image.jpeg,openapi,https://raw.githubusercontent.com/Adyen/adyen-openapi/master/json/BinLookupService-v50.json,https://api.apis.guru/v2/specs/adyen.com/BinLookupService/50/openapi.yaml,https://api.apis.guru/v2/specs/adyen.com/BinLookupService/50/openapi.yaml,345344,/adyen.com/BinLookupService/50/openapi.json
345199,amazonaws.com:autoscaling-plans,AWS Auto Scaling Plans," Use AWS Auto Scaling to create scaling plans for your applications to automatically scale your scalable AWS resources.   <b>API Summary</b>  You can use the AWS Auto Scaling service API to accomplish the following tasks:   Create and manage scaling plans   Define target tracking scaling policies to dynamically scale your resources based on utilization   Scale Amazon EC2 Auto Scaling groups using predictive scaling and dynamic scaling to scale your Amazon EC2 capacity faster   Set minimum and maximum capacity limits   Retrieve information on existing scaling plans   Access current forecast data and historical forecast data for up to 56 days previous   To learn more about AWS Auto Scaling, including information about granting IAM users required permissions for AWS Auto Scaling actions, see the <a href=""https://docs.aws.amazon.com/autoscaling/plans/userguide/what-is-aws-auto-scaling.html"">AWS Auto Scaling User Guide. ",cloud,https://api.apis.guru/v2/cache/logo/https_twitter.com_awscloud_profile_image.png,https_twitter.com_awscloud_profile_image.png,,https://raw.githubusercontent.com/aws/aws-sdk-js/master/apis/autoscaling-plans-2018-01-06.normal.json,https://api.apis.guru/v2/specs/amazonaws.com/autoscaling-plans/2018-01-06/openapi.yaml,https://api.apis.guru/v2/specs/amazonaws.com/autoscaling-plans/2018-01-06/openapi.yaml,345345,/amazonaws.com/autoscaling-plans/2018-01-06/openapi.json
345200,amazonaws.com:application-autoscaling,Application Auto Scaling,"With Application Auto Scaling, you can configure automatic scaling for the following resources:   Amazon AppStream 2.0 fleets   Amazon Aurora Replicas   Amazon Comprehend document classification and entity recognizer endpoints   Amazon DynamoDB tables and global secondary indexes throughput capacity   Amazon ECS services   Amazon ElastiCache for Redis clusters (replication groups)   Amazon EMR clusters   Amazon Keyspaces (for Apache Cassandra) tables   Lambda function provisioned concurrency   Amazon Managed Streaming for Apache Kafka broker storage   Amazon SageMaker endpoint variants   Spot Fleet (Amazon EC2) requests   Custom resources provided by your own applications or services    <b>API Summary</b>  The Application Auto Scaling service API includes three key sets of actions:    Register and manage scalable targets - Register Amazon Web Services or custom resources as scalable targets (a resource that Application Auto Scaling can scale), set minimum and maximum capacity limits, and retrieve information on existing scalable targets.   Configure and manage automatic scaling - Define scaling policies to dynamically scale your resources in response to CloudWatch alarms, schedule one-time or recurring scaling actions, and retrieve your recent scaling activity history.   Suspend and resume scaling - Temporarily suspend and later resume automatic scaling by calling the <a href=""https://docs.aws.amazon.com/autoscaling/application/APIReference/API_RegisterScalableTarget.html"">RegisterScalableTarget API action for any Application Auto Scaling scalable target. You can suspend and resume (individually or in combination) scale-out activities that are triggered by a scaling policy, scale-in activities that are triggered by a scaling policy, and scheduled scaling.   To learn more about Application Auto Scaling, including information about granting IAM users required permissions for Application Auto Scaling actions, see the <a href=""https://docs.aws.amazon.com/autoscaling/application/userguide/what-is-application-auto-scaling.html"">Application Auto Scaling User Guide.",cloud,https://api.apis.guru/v2/cache/logo/https_twitter.com_awscloud_profile_image.png,https_twitter.com_awscloud_profile_image.png,,https://raw.githubusercontent.com/aws/aws-sdk-js/master/apis/application-autoscaling-2016-02-06.normal.json,https://api.apis.guru/v2/specs/amazonaws.com/application-autoscaling/2016-02-06/openapi.yaml,https://api.apis.guru/v2/specs/amazonaws.com/application-autoscaling/2016-02-06/openapi.yaml,345346,/amazonaws.com/application-autoscaling/2016-02-06/openapi.json
345201,amazonaws.com:cognito-identity,Amazon Cognito Identity," Amazon Cognito Federated Identities is a web service that delivers scoped temporary credentials to mobile devices and other untrusted environments. It uniquely identifies a device and supplies the user with a consistent identity over the lifetime of an application. Using Amazon Cognito Federated Identities, you can enable authentication with one or more third-party identity providers (Facebook, Google, or Login with Amazon) or an Amazon Cognito user pool, and you can also choose to support unauthenticated access from your app. Cognito delivers a unique identifier for each user and acts as an OpenID token provider trusted by AWS Security Token Service (STS) to access temporary, limited-privilege AWS credentials. For a description of the authentication flow from the Amazon Cognito Developer Guide see <a href=""https://docs.aws.amazon.com/cognito/latest/developerguide/authentication-flow.html"">Authentication Flow. For more information see <a href=""https://docs.aws.amazon.com/cognito/latest/developerguide/cognito-identity.html"">Amazon Cognito Federated Identities.",cloud,https://api.apis.guru/v2/cache/logo/https_twitter.com_awscloud_profile_image.png,https_twitter.com_awscloud_profile_image.png,,https://raw.githubusercontent.com/aws/aws-sdk-js/master/apis/cognito-identity-2014-06-30.normal.json,https://api.apis.guru/v2/specs/amazonaws.com/cognito-identity/2014-06-30/openapi.yaml,https://api.apis.guru/v2/specs/amazonaws.com/cognito-identity/2014-06-30/openapi.yaml,345347,/amazonaws.com/cognito-identity/2014-06-30/openapi.json
345202,adyen.com:MarketPayNotificationService,Adyen for Platforms: Notifications,"The Notification API sends notifications to the endpoints specified in a given subscription. Subscriptions are managed through the Notification Configuration API. The API specifications listed here detail the format of each notification.For more information, refer to our [documentation](https://docs.adyen.com/platforms/notifications).",payment,https://api.apis.guru/v2/cache/logo/https_twitter.com_Adyen_profile_image,https_twitter.com_Adyen_profile_image,openapi,https://raw.githubusercontent.com/Adyen/adyen-openapi/master/json/MarketPayNotificationService-v6.json,https://api.apis.guru/v2/specs/adyen.com/MarketPayNotificationService/6/openapi.yaml,https://api.apis.guru/v2/specs/adyen.com/MarketPayNotificationService/6/openapi.yaml,345348,/adyen.com/MarketPayNotificationService/6/openapi.json
