id,project,title,description,categories,logo,file_name,origin_format,origin_url,swaggerYamlUrl,swaggerYamlUrl,import_id,swaggerUrl
345122,ably.io:platform,Platform API,The [REST API specification](https://www.ably.io/documentation/rest-api) for Ably.,cloud,https://api.apis.guru/v2/cache/logo/https_twitter.com_ablyrealtime_profile_image,https_twitter.com_ablyrealtime_profile_image,openapi,https://raw.githubusercontent.com/ably/open-specs/main/definitions/platform-v1.yaml,https://api.apis.guru/v2/specs/ably.io/platform/1.1.0/openapi.yaml,https://api.apis.guru/v2/specs/ably.io/platform/1.1.0/openapi.yaml,345268,/ably.io/platform/1.1.0/openapi.json
345123,amazonaws.com:cloud9,AWS Cloud9," Cloud9 is a collection of tools that you can use to code, build, run, test, debug, and release software in the cloud. For more information about Cloud9, see the <a href=""https://docs.aws.amazon.com/cloud9/latest/user-guide"">Cloud9 User Guide. Cloud9 supports these operations:    <code>CreateEnvironmentEC2</code>: Creates an Cloud9 development environment, launches an Amazon EC2 instance, and then connects from the instance to the environment.    <code>CreateEnvironmentMembership</code>: Adds an environment member to an environment.    <code>DeleteEnvironment</code>: Deletes an environment. If an Amazon EC2 instance is connected to the environment, also terminates the instance.    <code>DeleteEnvironmentMembership</code>: Deletes an environment member from an environment.    <code>DescribeEnvironmentMemberships</code>: Gets information about environment members for an environment.    <code>DescribeEnvironments</code>: Gets information about environments.    <code>DescribeEnvironmentStatus</code>: Gets status information for an environment.    <code>ListEnvironments</code>: Gets a list of environment identifiers.    <code>ListTagsForResource</code>: Gets the tags for an environment.    <code>TagResource</code>: Adds tags to an environment.    <code>UntagResource</code>: Removes tags from an environment.    <code>UpdateEnvironment</code>: Changes the settings of an existing environment.    <code>UpdateEnvironmentMembership</code>: Changes the settings of an existing environment member for an environment.  ",cloud,https://api.apis.guru/v2/cache/logo/https_twitter.com_awscloud_profile_image.png,https_twitter.com_awscloud_profile_image.png,,https://raw.githubusercontent.com/aws/aws-sdk-js/master/apis/cloud9-2017-09-23.normal.json,https://api.apis.guru/v2/specs/amazonaws.com/cloud9/2017-09-23/openapi.yaml,https://api.apis.guru/v2/specs/amazonaws.com/cloud9/2017-09-23/openapi.yaml,345269,/amazonaws.com/cloud9/2017-09-23/openapi.json
345124,amazonaws.com:application-insights,Amazon CloudWatch Application Insights,"  Amazon CloudWatch Application Insights is a service that helps you detect common problems with your applications. It enables you to pinpoint the source of issues in your applications (built with technologies such as Microsoft IIS, .NET, and Microsoft SQL Server), by providing key insights into detected problems. After you onboard your application, CloudWatch Application Insights identifies, recommends, and sets up metrics and logs. It continuously analyzes and correlates your metrics and logs for unusual behavior to surface actionable problems with your application. For example, if your application is slow and unresponsive and leading to HTTP 500 errors in your Application Load Balancer (ALB), Application Insights informs you that a memory pressure problem with your SQL Server database is occurring. It bases this analysis on impactful metrics and log errors. ",cloud,https://api.apis.guru/v2/cache/logo/https_twitter.com_awscloud_profile_image.png,https_twitter.com_awscloud_profile_image.png,,https://raw.githubusercontent.com/aws/aws-sdk-js/master/apis/application-insights-2018-11-25.normal.json,https://api.apis.guru/v2/specs/amazonaws.com/application-insights/2018-11-25/openapi.yaml,https://api.apis.guru/v2/specs/amazonaws.com/application-insights/2018-11-25/openapi.yaml,345270,/amazonaws.com/application-insights/2018-11-25/openapi.json
345125,amazonaws.com:ecs,Amazon EC2 Container Service," Amazon Elastic Container Service (Amazon ECS) is a highly scalable, fast, container management service that makes it easy to run, stop, and manage Docker containers on a cluster. You can host your cluster on a serverless infrastructure that is managed by Amazon ECS by launching your services or tasks on Fargate. For more control, you can host your tasks on a cluster of Amazon Elastic Compute Cloud (Amazon EC2) instances that you manage. Amazon ECS makes it easy to launch and stop container-based applications with simple API calls, allows you to get the state of your cluster from a centralized service, and gives you access to many familiar Amazon EC2 features. You can use Amazon ECS to schedule the placement of containers across your cluster based on your resource needs, isolation policies, and availability requirements. Amazon ECS eliminates the need for you to operate your own cluster management and configuration management systems or worry about scaling your management infrastructure.",cloud,https://api.apis.guru/v2/cache/logo/https_twitter.com_awscloud_profile_image.png,https_twitter.com_awscloud_profile_image.png,,https://raw.githubusercontent.com/aws/aws-sdk-js/master/apis/ecs-2014-11-13.normal.json,https://api.apis.guru/v2/specs/amazonaws.com/ecs/2014-11-13/openapi.yaml,https://api.apis.guru/v2/specs/amazonaws.com/ecs/2014-11-13/openapi.yaml,345271,/amazonaws.com/ecs/2014-11-13/openapi.json
345126,amazonaws.com:ecr,Amazon EC2 Container Registry," Amazon Elastic Container Registry (Amazon ECR) is a managed container image registry service. Customers can use the familiar Docker CLI, or their preferred client, to push, pull, and manage images. Amazon ECR provides a secure, scalable, and reliable registry for your Docker or Open Container Initiative (OCI) images. Amazon ECR supports private repositories with resource-based permissions using IAM so that specific users or Amazon EC2 instances can access repositories and images. Amazon ECR has service endpoints in each supported Region. For more information, see <a href=""https://docs.aws.amazon.com/general/latest/gr/ecr.html"">Amazon ECR endpoints in the <i>Amazon Web Services General Reference</i>.",cloud,https://api.apis.guru/v2/cache/logo/https_twitter.com_awscloud_profile_image.png,https_twitter.com_awscloud_profile_image.png,,https://raw.githubusercontent.com/aws/aws-sdk-js/master/apis/ecr-2015-09-21.normal.json,https://api.apis.guru/v2/specs/amazonaws.com/ecr/2015-09-21/openapi.yaml,https://api.apis.guru/v2/specs/amazonaws.com/ecr/2015-09-21/openapi.yaml,345272,/amazonaws.com/ecr/2015-09-21/openapi.json
345127,amazonaws.com:dms,AWS Database Migration Service," Database Migration Service (DMS) can migrate your data to and from the most widely used commercial and open-source databases such as Oracle, PostgreSQL, Microsoft SQL Server, Amazon Redshift, MariaDB, Amazon Aurora, MySQL, and SAP Adaptive Server Enterprise (ASE). The service supports homogeneous migrations such as Oracle to Oracle, as well as heterogeneous migrations between different database platforms, such as Oracle to MySQL or SQL Server to PostgreSQL. For more information about DMS, see <a href=""https://docs.aws.amazon.com/dms/latest/userguide/Welcome.html"">What Is Database Migration Service? in the <i>Database Migration Service User Guide.</i> ",cloud,https://api.apis.guru/v2/cache/logo/https_twitter.com_awscloud_profile_image.png,https_twitter.com_awscloud_profile_image.png,,https://raw.githubusercontent.com/aws/aws-sdk-js/master/apis/dms-2016-01-01.normal.json,https://api.apis.guru/v2/specs/amazonaws.com/dms/2016-01-01/openapi.yaml,https://api.apis.guru/v2/specs/amazonaws.com/dms/2016-01-01/openapi.yaml,345273,/amazonaws.com/dms/2016-01-01/openapi.json
345128,amazonaws.com:cloudfront,Amazon CloudFront," This is the <i>Amazon CloudFront API Reference</i>. This guide is for developers who need detailed information about CloudFront API actions, data types, and errors. For detailed information about CloudFront features, see the <i>Amazon CloudFront Developer Guide</i>.",cloud,https://api.apis.guru/v2/cache/logo/https_twitter.com_awscloud_profile_image.png,https_twitter.com_awscloud_profile_image.png,,https://raw.githubusercontent.com/aws/aws-sdk-js/master/apis/cloudfront-2020-05-31.normal.json,https://api.apis.guru/v2/specs/amazonaws.com/cloudfront/2020-05-31/openapi.yaml,https://api.apis.guru/v2/specs/amazonaws.com/cloudfront/2020-05-31/openapi.yaml,345274,/amazonaws.com/cloudfront/2020-05-31/openapi.json
345129,amazonaws.com:appsync,AWS AppSync,AppSync provides API actions for creating and interacting with data sources using GraphQL from your application.,cloud,https://api.apis.guru/v2/cache/logo/https_twitter.com_awscloud_profile_image.png,https_twitter.com_awscloud_profile_image.png,,https://raw.githubusercontent.com/aws/aws-sdk-js/master/apis/appsync-2017-07-25.normal.json,https://api.apis.guru/v2/specs/amazonaws.com/appsync/2017-07-25/openapi.yaml,https://api.apis.guru/v2/specs/amazonaws.com/appsync/2017-07-25/openapi.yaml,345275,/amazonaws.com/appsync/2017-07-25/openapi.json
345130,amazonaws.com:cloudhsmv2,AWS CloudHSM V2,"For more information about AWS CloudHSM, see <a href=""http://aws.amazon.com/cloudhsm/"">AWS CloudHSM and the <a href=""https://docs.aws.amazon.com/cloudhsm/latest/userguide/"">AWS CloudHSM User Guide.",cloud,https://api.apis.guru/v2/cache/logo/https_twitter.com_awscloud_profile_image.png,https_twitter.com_awscloud_profile_image.png,,https://raw.githubusercontent.com/aws/aws-sdk-js/master/apis/cloudhsmv2-2017-04-28.normal.json,https://api.apis.guru/v2/specs/amazonaws.com/cloudhsmv2/2017-04-28/openapi.yaml,https://api.apis.guru/v2/specs/amazonaws.com/cloudhsmv2/2017-04-28/openapi.yaml,345276,/amazonaws.com/cloudhsmv2/2017-04-28/openapi.json
345131,adyen.com:CheckoutUtilityService,Adyen Checkout Utility Service,"A web service containing utility functions available for merchants integrating with Checkout APIs.## AuthenticationEach request to the Checkout Utility API must be signed with an API key. For this, obtain an API Key from your Customer Area, as described in [How to get the Checkout API key](https://docs.adyen.com/developers/user-management/how-to-get-the-checkout-api-key). Then set this key to the `X-API-Key` header value, for example:```curl-H ""Content-Type: application/json"" \-H ""X-API-Key: Your_Checkout_API_key"" \...```Note that when going live, you need to generate a new API Key to access the [live endpoints](https://docs.adyen.com/developers/api-reference/live-endpoints).## VersioningCheckout API supports versioning of its endpoints through a version suffix in the endpoint URL. This suffix has the following format: ""vXX"", where XX is the version number.For example:```https://checkout-test.adyen.com/v1/originKeys```",payment,https://api.apis.guru/v2/cache/logo/https_twitter.com_Adyen_profile_image.jpeg,https_twitter.com_Adyen_profile_image.jpeg,openapi,https://raw.githubusercontent.com/adyen/adyen-openapi/master/specs/3.0/CheckoutUtilityService-v1.json,https://api.apis.guru/v2/specs/adyen.com/CheckoutUtilityService/1/openapi.yaml,https://api.apis.guru/v2/specs/adyen.com/CheckoutUtilityService/1/openapi.yaml,345277,/adyen.com/CheckoutUtilityService/1/openapi.json
345132,amazonaws.com:codeartifact,CodeArtifact," AWS CodeArtifact is a fully managed artifact repository compatible with language-native package managers and build tools such as npm, Apache Maven, and pip. You can use CodeArtifact to share packages with development teams and pull packages. Packages can be pulled from both public and CodeArtifact repositories. You can also create an upstream relationship between a CodeArtifact repository and another repository, which effectively merges their contents from the point of view of a package manager client.   <b>AWS CodeArtifact Components</b>  Use the information in this guide to help you work with the following CodeArtifact components:    <b>Repository</b>: A CodeArtifact repository contains a set of <a href=""https://docs.aws.amazon.com/codeartifact/latest/ug/welcome.html#welcome-concepts-package-version"">package versions, each of which maps to a set of assets, or files. Repositories are polyglot, so a single repository can contain packages of any supported type. Each repository exposes endpoints for fetching and publishing packages using tools like the <b> <code>npm</code> </b> CLI, the Maven CLI (<b> <code>mvn</code> </b>), and <b> <code>pip</code> </b>.    <b>Domain</b>: Repositories are aggregated into a higher-level entity known as a <i>domain</i>. All package assets and metadata are stored in the domain, but are consumed through repositories. A given package asset, such as a Maven JAR file, is stored once per domain, no matter how many repositories it's present in. All of the assets and metadata in a domain are encrypted with the same customer master key (CMK) stored in AWS Key Management Service (AWS KMS). Each repository is a member of a single domain and can't be moved to a different domain. The domain allows organizational policy to be applied across multiple repositories, such as which accounts can access repositories in the domain, and which public repositories can be used as sources of packages. Although an organization can have multiple domains, we recommend a single production domain that contains all published artifacts so that teams can find and share packages across their organization.    <b>Package</b>: A <i>package</i> is a bundle of software and the metadata required to resolve dependencies and install the software. CodeArtifact supports <a href=""https://docs.aws.amazon.com/codeartifact/latest/ug/using-npm.html"">npm, <a href=""https://docs.aws.amazon.com/codeartifact/latest/ug/using-python.html"">PyPI, and <a href=""https://docs.aws.amazon.com/codeartifact/latest/ug/using-maven"">Maven package formats. In CodeArtifact, a package consists of:   A <i>name</i> (for example, <code>webpack</code> is the name of a popular npm package)   An optional namespace (for example, <code>@types</code> in <code>@types/node</code>)   A set of versions (for example, <code>1.0.0</code>, <code>1.0.1</code>, <code>1.0.2</code>, etc.)    Package-level metadata (for example, npm tags)      <b>Package version</b>: A version of a package, such as <code>@types/node 12.6.9</code>. The version number format and semantics vary for different package formats. For example, npm package versions must conform to the <a href=""https://semver.org/"">Semantic Versioning specification. In CodeArtifact, a package version consists of the version identifier, metadata at the package version level, and a set of assets.    <b>Upstream repository</b>: One repository is <i>upstream</i> of another when the package versions in it can be accessed from the repository endpoint of the downstream repository, effectively merging the contents of the two repositories from the point of view of a client. CodeArtifact allows creating an upstream relationship between two repositories.    <b>Asset</b>: An individual file stored in CodeArtifact associated with a package version, such as an npm <code>.tgz</code> file or Maven POM and JAR files.   CodeArtifact supports these operations:    <code>AssociateExternalConnection</code>: Adds an existing external connection to a repository.     <code>CopyPackageVersions</code>: Copies package versions from one repository to another repository in the same domain.    <code>CreateDomain</code>: Creates a domain    <code>CreateRepository</code>: Creates a CodeArtifact repository in a domain.     <code>DeleteDomain</code>: Deletes a domain. You cannot delete a domain that contains repositories.     <code>DeleteDomainPermissionsPolicy</code>: Deletes the resource policy that is set on a domain.    <code>DeletePackageVersions</code>: Deletes versions of a package. After a package has been deleted, it can be republished, but its assets and metadata cannot be restored because they have been permanently removed from storage.    <code>DeleteRepository</code>: Deletes a repository.     <code>DeleteRepositoryPermissionsPolicy</code>: Deletes the resource policy that is set on a repository.    <code>DescribeDomain</code>: Returns a <code>DomainDescription</code> object that contains information about the requested domain.    <code>DescribePackageVersion</code>: Returns a <a href=""https://docs.aws.amazon.com/codeartifact/latest/APIReference/API_PackageVersionDescription.html"">PackageVersionDescription object that contains details about a package version.     <code>DescribeRepository</code>: Returns a <code>RepositoryDescription</code> object that contains detailed information about the requested repository.     <code>DisposePackageVersions</code>: Disposes versions of a package. A package version with the status <code>Disposed</code> cannot be restored because they have been permanently removed from storage.    <code>DisassociateExternalConnection</code>: Removes an existing external connection from a repository.     <code>GetAuthorizationToken</code>: Generates a temporary authorization token for accessing repositories in the domain. The token expires the authorization period has passed. The default authorization period is 12 hours and can be customized to any length with a maximum of 12 hours.    <code>GetDomainPermissionsPolicy</code>: Returns the policy of a resource that is attached to the specified domain.     <code>GetPackageVersionAsset</code>: Returns the contents of an asset that is in a package version.     <code>GetPackageVersionReadme</code>: Gets the readme file or descriptive text for a package version.    <code>GetRepositoryEndpoint</code>: Returns the endpoint of a repository for a specific package format. A repository has one endpoint for each package format:     <code>npm</code>     <code>pypi</code>     <code>maven</code>       <code>GetRepositoryPermissionsPolicy</code>: Returns the resource policy that is set on a repository.     <code>ListDomains</code>: Returns a list of <code>DomainSummary</code> objects. Each returned <code>DomainSummary</code> object contains information about a domain.    <code>ListPackages</code>: Lists the packages in a repository.    <code>ListPackageVersionAssets</code>: Lists the assets for a given package version.    <code>ListPackageVersionDependencies</code>: Returns a list of the direct dependencies for a package version.     <code>ListPackageVersions</code>: Returns a list of package versions for a specified package in a repository.    <code>ListRepositories</code>: Returns a list of repositories owned by the AWS account that called this method.    <code>ListRepositoriesInDomain</code>: Returns a list of the repositories in a domain.    <code>PutDomainPermissionsPolicy</code>: Attaches a resource policy to a domain.    <code>PutRepositoryPermissionsPolicy</code>: Sets the resource policy on a repository that specifies permissions to access it.     <code>UpdatePackageVersionsStatus</code>: Updates the status of one or more versions of a package.    <code>UpdateRepository</code>: Updates the properties of a repository.  ",cloud,https://api.apis.guru/v2/cache/logo/https_twitter.com_awscloud_profile_image.png,https_twitter.com_awscloud_profile_image.png,,https://raw.githubusercontent.com/aws/aws-sdk-js/master/apis/codeartifact-2018-09-22.normal.json,https://api.apis.guru/v2/specs/amazonaws.com/codeartifact/2018-09-22/openapi.yaml,https://api.apis.guru/v2/specs/amazonaws.com/codeartifact/2018-09-22/openapi.yaml,345278,/amazonaws.com/codeartifact/2018-09-22/openapi.json
345133,amazonaws.com:dlm,Amazon Data Lifecycle Manager," With Amazon Data Lifecycle Manager, you can manage the lifecycle of your Amazon Web Services resources. You create lifecycle policies, which are used to automate operations on the specified resources. Amazon DLM supports Amazon EBS volumes and snapshots. For information about using Amazon DLM with Amazon EBS, see <a href=""https://docs.aws.amazon.com/AWSEC2/latest/UserGuide/snapshot-lifecycle.html"">Automating the Amazon EBS Snapshot Lifecycle in the <i>Amazon EC2 User Guide</i>.",cloud,https://api.apis.guru/v2/cache/logo/https_twitter.com_awscloud_profile_image.png,https_twitter.com_awscloud_profile_image.png,,https://raw.githubusercontent.com/aws/aws-sdk-js/master/apis/dlm-2018-01-12.normal.json,https://api.apis.guru/v2/specs/amazonaws.com/dlm/2018-01-12/openapi.yaml,https://api.apis.guru/v2/specs/amazonaws.com/dlm/2018-01-12/openapi.yaml,345279,/amazonaws.com/dlm/2018-01-12/openapi.json
345134,amazonaws.com:appstream,Amazon AppStream," This is the <i>Amazon AppStream 2.0 API Reference</i>. This documentation provides descriptions and syntax for each of the actions and data types in AppStream 2.0. AppStream 2.0 is a fully managed, secure application streaming service that lets you stream desktop applications to users without rewriting applications. AppStream 2.0 manages the AWS resources that are required to host and run your applications, scales automatically, and provides access to your users on demand.  <note> You can call the AppStream 2.0 API operations by using an interface VPC endpoint (interface endpoint). For more information, see <a href=""https://docs.aws.amazon.com/appstream2/latest/developerguide/access-api-cli-through-interface-vpc-endpoint.html"">Access AppStream 2.0 API Operations and CLI Commands Through an Interface VPC Endpoint in the <i>Amazon AppStream 2.0 Administration Guide</i>. </note> To learn more about AppStream 2.0, see the following resources:    <a href=""http://aws.amazon.com/appstream2"">Amazon AppStream 2.0 product page     <a href=""http://aws.amazon.com/documentation/appstream2"">Amazon AppStream 2.0 documentation   ",cloud,https://api.apis.guru/v2/cache/logo/https_twitter.com_awscloud_profile_image.png,https_twitter.com_awscloud_profile_image.png,,https://raw.githubusercontent.com/aws/aws-sdk-js/master/apis/appstream-2016-12-01.normal.json,https://api.apis.guru/v2/specs/amazonaws.com/appstream/2016-12-01/openapi.yaml,https://api.apis.guru/v2/specs/amazonaws.com/appstream/2016-12-01/openapi.yaml,345280,/amazonaws.com/appstream/2016-12-01/openapi.json
345135,amazonaws.com:cloudformation,AWS CloudFormation," CloudFormation allows you to create and manage Amazon Web Services infrastructure deployments predictably and repeatedly. You can use CloudFormation to leverage Amazon Web Services products, such as Amazon Elastic Compute Cloud, Amazon Elastic Block Store, Amazon Simple Notification Service, Elastic Load Balancing, and Auto Scaling to build highly-reliable, highly scalable, cost-effective applications without creating or configuring the underlying Amazon Web Services infrastructure. With CloudFormation, you declare all of your resources and dependencies in a template file. The template defines a collection of resources as a single unit called a stack. CloudFormation creates and deletes all member resources of the stack together and manages all dependencies between the resources for you. For more information about CloudFormation, see the <a href=""http://aws.amazon.com/cloudformation/"">CloudFormation Product Page. CloudFormation makes use of other Amazon Web Services products. If you need additional technical information about a specific Amazon Web Services product, you can find the product's technical documentation at <a href=""https://docs.aws.amazon.com/""> <code>docs.aws.amazon.com</code> .",cloud,https://api.apis.guru/v2/cache/logo/https_twitter.com_awscloud_profile_image.png,https_twitter.com_awscloud_profile_image.png,,https://raw.githubusercontent.com/aws/aws-sdk-js/master/apis/cloudformation-2010-05-15.normal.json,https://api.apis.guru/v2/specs/amazonaws.com/cloudformation/2010-05-15/openapi.yaml,https://api.apis.guru/v2/specs/amazonaws.com/cloudformation/2010-05-15/openapi.yaml,345281,/amazonaws.com/cloudformation/2010-05-15/openapi.json
